{"schema_version":1,"event_id":"ds3_paysim:1","trace_id":"trace-1","dataset_id":"ds3_paysim","source_row_id":"1","event_type":"mobile_money_transaction","event_time":{"kind":"relative","unit":"hours","value":1,"origin":null},"payload":{"transaction_type":"TRANSFER","amount":12.5},"ground_truth":{"is_fraud":false},"provenance":{"source_file":"PS_20174392719_1491204439457_log.csv","source_kind":"synthetic_simulation"}}
